{"artifactId":"art-skill-progress-tracker-enforcement-build-20260904","artifacts":[],"completion":null,"control":{"activeTasks":[],"blockers":[],"currentState":"COMPLETE","cycle":0,"lastCheckpoint":"2026-09-04T23:20:00Z: shipped on fa79f36; CI run 33928035357 fully green","lastModelRun":"gpt-5.6-sol / skill-progress-tracker-enforcement-build","nextTransition":"none — build complete"},"inputs":[{"artifactId":"art-skill-progress-tracker-enforcement-20260904","digest":"sha256:d8d9157024784e531414408a2e0969cfcddc57d1047f4ec28b2f5afa03c3994e","name":"plan","owner":"csm-plan","path":".agents/plans/2026-09-04-skill-progress-tracker-enforcement-csm.json","runId":"run-20260904t190000z-skill-progress-tracker-enforcement","schema":"csm-plan/1","status":"resolved"}],"journal":[{"evidence":"Explicit csm-build request selected the saved plan. Repository clean at c4f6590.","from":"NOT_STARTED","sequence":0,"timestamp":"2026-09-04T20:00:00Z","to":"RECOVER"},{"evidence":"T001: schema + helper + 5 contract tests. T002: check-suite gate validates .agents/progress/*.json, phrase list swapped. T003: 28 SKILL.md files (14 root + 14 payload) updated, pack synced. T005: progress-rollup.mjs + 4 tests + opt-in call site. T004: seed record persisted and validated. All gates green: 22 focused tests, check-suite 1244 OK, fmt/lint/diff clean.","from":"RECOVER","sequence":1,"timestamp":"2026-09-04T21:00:00Z","to":"CHECKPOINT"},{"evidence":"Commit/push authorized; formatting, payload inclusion, capability digests, and pinned test digest fixed; CI run 33928035357 all 4 jobs success; plan closed complete","from":"CHECKPOINT","sequence":2,"timestamp":"2026-09-04T23:20:00Z","to":"COMPLETE"}],"owner":"csm-build","projection":{"allowed":["markdown","html"],"sourceOnly":true},"provenance":{"sourceDigests":[],"sourcePlan":"art-skill-progress-tracker-enforcement-20260904"},"runId":"run-20260904t200000z-skill-progress-tracker-enforcement-build","schema":"csm-build-state/2","schemaRevision":2,"status":"complete"}
