{"artifactId":"art-orchestrate-request-intake-router-build-20260906","artifacts":[],"completion":{"commit":{"files":[],"message":"","sha":null,"status":"not-requested"},"evidence":[],"rollback":{"action":"migration: rollback metadata not recorded","checkpoint":null,"status":"unavailable"},"status":"complete","verifiedAt":"2026-09-07T00:48:09Z"},"control":{"activeTasks":[],"blockers":[],"currentState":"COMPLETE","cycle":0,"lastCheckpoint":"2026-09-07T00:48:09Z: T001-T007 complete; battery green; merge pending","lastModelRun":"deepseek-v4-flash / orchestrate-request-intake-router-build","nextTransition":"none (terminal)"},"inputs":[{"artifactId":"art-orchestrate-request-intake-router-20260906","digest":"sha256:a763f34ad2adc87ded4cf80952d51a74de04c36e45ed3e22350a43e30a89c117","name":"plan","owner":"csm-plan","path":".agents/plans/2026-09-06-orchestrate-request-intake-router-csm.json","runId":"run-20260906t230626z-4f3a9b2c1d8e","schema":"csm-plan/1","status":"resolved"}],"journal":[{"evidence":"explicit csm-build invocation; worktree at 0b22280","from":"NOT_STARTED","sequence":0,"timestamp":"2026-09-06T23:21:53Z","to":"RECOVER"},{"evidence":"T001-T004 complete (plan journal seq 5).","from":"DISPATCH","sequence":1,"timestamp":"2026-09-06T23:55:53Z","to":"CHECKPOINT"},{"evidence":"T005-T007 complete (plan journal seq 6).","from":"CHECKPOINT","sequence":2,"timestamp":"2026-09-07T00:48:09Z","to":"COMPLETE"},{"evidence":"migration: legacy completion metadata {\"summary\":\"delivered on branch; merge + main gate pending\",\"evidenceRefs\":[]}","from":"COMPLETE","inputDigests":[],"sequence":3,"timestamp":"2026-09-07T00:48:09Z","to":"COMPLETE"}],"owner":"csm-build","projection":{"allowed":["markdown","html"],"sourceOnly":true},"provenance":{"sourceDigests":["sha256:fa0f07d2a9a2e842b9042170282b3774521f7b7ecb8c22054dc28906be205d53"],"sourcePlan":"art-orchestrate-request-intake-router-20260906"},"runId":"run-20260906t232118z-orchestrate-request-intake-router-build","schema":"csm-build-state/2","schemaRevision":2,"status":"complete"}
