{"artifactId":"art-ci-blockers-followup-build-20260903","artifacts":[],"completion":null,"control":{"activeTasks":["T003"],"blockers":["pnpm audit repeatedly fails with ERR_SOCKET_TIMEOUT against registry.npmjs.org; required CI cannot reach the adapter job."],"currentState":"BLOCKED","cycle":0,"lastCheckpoint":"2026-09-03T23:30:00Z: f26eb74 pushed; CI blocked by repeated npm registry audit timeout","lastModelRun":"gpt-5.6-luna / ci-blockers-followup-build","nextTransition":"BLOCKED -> RECOVER after npm registry audit service recovers"},"inputs":[{"artifactId":"art-ci-blockers-followup-20260903","digest":"sha256:1ddfe48ee7af98ca80897dba464c885e001c0ac64c7fcf0d4aa11e5c3b487eb7","name":"plan","owner":"csm-plan","path":".agents/plans/2026-09-03-ci-blockers-followup-csm.json","runId":"run-20260903t080000z-ci-blockers-followup","schema":"csm-plan/1","status":"resolved"}],"journal":[{"evidence":"Explicit csm-build request selected the saved follow-up plan. Repository is clean at fc11fa6; latest adapter command evidence is green, but full exact-SHA verification is incomplete and prior CI run 33726800933 stalled before Adapter integrations.","from":"NOT_STARTED","sequence":0,"timestamp":"2026-09-03T09:00:00Z","to":"RECOVER"},{"evidence":"Commit f26eb74 was pushed. Run 33812953261 and its failed-job rerun both failed Frozen install because pnpm audit timed out against registry.npmjs.org after retries; no required adapter verification occurred on the repair SHA.","from":"RECOVER","sequence":3,"timestamp":"2026-09-03T23:30:00Z","to":"BLOCKED"},{"evidence":"T001 validated with local test-scan 1283/1283 and rerun 33726800933 passing Repository gates. T002 validated with focused adapter wiring, formatting, whitespace, and repository checks; current workflow repair is uncommitted. T003 requires explicit commit/push authorization before exact-SHA verification.","from":"RECOVER","sequence":1,"timestamp":"2026-09-03T22:30:00Z","to":"BLOCKED"},{"evidence":"User explicitly authorized commit, push, and merge in the current invocation. The owned change set is .github/workflows/ci.yml plus the plan and build-state checkpoint.","from":"BLOCKED","sequence":2,"timestamp":"2026-09-03T23:00:00Z","to":"RECOVER"}],"owner":"csm-build","projection":{"allowed":["markdown","html"],"sourceOnly":true},"provenance":{"sourceDigests":["sha256:1ddfe48ee7af98ca80897dba464c885e001c0ac64c7fcf0d4aa11e5c3b487eb7"],"sourcePlan":"art-ci-blockers-followup-20260903"},"runId":"run-20260903t090000z-ci-blockers-followup-build","schema":"csm-build-state/2","schemaRevision":2,"status":"blocked"}
