{"artifactId":"art-build-all-orchestrate-adapters-20260831","artifacts":[],"completion":null,"control":{"activeTasks":[],"blockers":[],"currentState":"RECOVER","cycle":0,"lastCheckpoint":"2026-08-31T06:10:00Z: explicit build request received; validating all-adapter plan and research input","lastModelRun":"gpt-5.6-luna / build-all-orchestrate-adapters","nextTransition":"RECOVER -> VALIDATE"},"inputs":[{"artifactId":"art-build-all-orchestrate-adapters-20260831","digest":"sha256:9227cb06dd22db878427380ce75cd189a17240e17116aa7afe821e349acd5a4a","name":"plan","owner":"csm-plan","path":".agents/plans/2026-08-31-build-all-orchestrate-adapters-csm.json","runId":"run-20260831t060000z-build-all-orchestrate-adapters","schema":"csm-plan/1","status":"resolved"}],"journal":[{"evidence":"Explicit csm-build request received; all-adapter plan and deep-research input are being validated before dispatch.","from":"NOT_STARTED","inputDigests":[],"sequence":0,"timestamp":"2026-08-31T06:10:00Z","to":"RECOVER"}],"owner":"csm-build","projection":{"allowed":["markdown","html"],"sourceOnly":true},"provenance":{"sourceDigests":["sha256:9227cb06dd22db878427380ce75cd189a17240e17116aa7afe821e349acd5a4a"],"sourcePlan":"art-build-all-orchestrate-adapters-20260831"},"runId":"run-20260831t061000z-build-all-orchestrate-adapters","schema":"csm-build-state/2","schemaRevision":2,"status":"in_progress"}
