{"artifactId":"art-dynamic-worker-runtime-final-gaps-build-20260912","artifacts":[],"completion":null,"control":{"activeTasks":[],"blockers":[],"currentState":"CHECKPOINT","cycle":1,"lastCheckpoint":"2026-09-12T18:43:15.256Z: final-gaps cycle 1 - sustained heartbeat + driver dynamic/config flags landed; T001/T002/T003 acceptance tests pending; T004-T012 remain","lastModelRun":"deepseek-flash / dwrr-final-build","nextTransition":"CHECKPOINT -> SELECT"},"inputs":[{"artifactId":"art-dynamic-worker-runtime-final-gaps-20260912","digest":"sha256:55ca43e06954c8ecb1ad08f520c3040560d737d3aea6b3a240bf1f6cc39f4a89","name":"plan","owner":"csm-plan","path":".agents/plans/2026-09-12-dynamic-worker-runtime-final-gaps-csm.json","runId":"run-20260912t200000z-dwrr-final","schema":"csm-plan/1","status":"resolved"}],"journal":[{"evidence":"explicit csm-build invocation","from":"NOT_STARTED","sequence":0,"timestamp":"2026-09-12T18:43:15.259Z","to":"RECOVER"},{"evidence":"sustained heartbeat + driver flags","from":"SELECT","sequence":1,"timestamp":"2026-09-12T18:43:15.259Z","to":"DISPATCH"},{"evidence":"test-orchestrate 327/0; worker-runtime 104/0; cycle 1","from":"VERIFY","sequence":2,"timestamp":"2026-09-12T18:43:15.259Z","to":"CHECKPOINT"}],"owner":"csm-build","projection":{"allowed":["markdown","html"],"sourceOnly":true},"provenance":{"sourceDigests":["sha256:55ca43e06954c8ecb1ad08f520c3040560d737d3aea6b3a240bf1f6cc39f4a89"],"sourcePlan":"art-dynamic-worker-runtime-final-gaps-20260912"},"runId":"run-20260912t200000z-dwrr-final-build","schema":"csm-build-state/2","schemaRevision":2,"status":"in_progress"}
