{"artifactId":"art-close-live-evidence-ci-build-20260901","artifacts":[],"completion":null,"control":{"activeTasks":["T001","T002"],"blockers":["Live browse proof still depends on migration-mode/test resolver for PNG evidence","Live Docker proof does not yet prove production-resolver-valid persisted review receipt/artifact records"],"currentState":"BLOCKED","cycle":0,"lastCheckpoint":"2026-09-01T05:00:00Z: live proofs pass but production evidence boundary remains blocked","lastModelRun":"gpt-5.6-luna / close-live-evidence-ci-build","nextTransition":"none (terminal)"},"inputs":[{"artifactId":"art-close-live-evidence-ci-20260901","digest":"sha256:908a26064fd424538eccf6d15697f077cc82a70a90b598527d8379795a8061c7","name":"plan","owner":"csm-plan","path":".agents/plans/2026-09-01-close-live-evidence-ci-csm.json","runId":"run-20260901t030000z-close-live-evidence-ci","schema":"csm-plan/1","status":"resolved"}],"journal":[{"evidence":"Explicit csm-build request selected the evidence-closure plan; current dirty implementation state and parent plan were validated before dispatch.","from":"NOT_STARTED","sequence":0,"timestamp":"2026-09-01T04:00:00Z","to":"RECOVER"},{"evidence":"T001/T002 live acceptance tests pass, but independent review found production resolver compatibility and persisted review-record gaps. Resume through RECOVER after those boundaries are repaired.","from":"RECOVER","sequence":1,"timestamp":"2026-09-01T05:00:00Z","to":"BLOCKED"}],"owner":"csm-build","projection":{"allowed":["markdown","html"],"sourceOnly":true},"provenance":{"sourceDigests":["sha256:908a26064fd424538eccf6d15697f077cc82a70a90b598527d8379795a8061c7"],"sourcePlan":"art-close-live-evidence-ci-20260901"},"runId":"run-20260901t040000z-close-live-evidence-ci-build","schema":"csm-build-state/2","schemaRevision":2,"status":"blocked"}
