{"artifactId":"art-build-progress-followups-20260830","artifacts":[],"completion":null,"control":{"activeTasks":["T001","T002"],"blockers":[],"currentState":"SELECT","cycle":0,"lastCheckpoint":"2026-08-30T04:25:00Z: follow-up plan validated and T001/T002 selected","lastModelRun":"gpt-5.6-luna / progress-followups-build","nextTransition":"SELECT -> DISPATCH"},"inputs":[{"artifactId":"art-progress-followups-20260830","digest":"sha256:4c3286411346de7f21ade5badb6bcced1cbd5ee46c034cfe901bf1d53c90fb2c","name":"plan","owner":"csm-plan","path":".agents/plans/2026-08-30-progress-followups-csm.json","runId":"run-20260830t040000z-progress-followups","schema":"csm-plan/1","status":"resolved"}],"journal":[{"evidence":"Explicit csm-build request received; selected the follow-up plan and preserved the clean merged baseline.","from":"NOT_STARTED","inputDigests":["sha256:ad152a2c4a09efa5247fb9893827cf2d914d587395e2751146bb94cae00bad4d"],"sequence":0,"timestamp":"2026-08-30T04:20:00Z","to":"RECOVER"},{"evidence":"Plan/build-state schemas and input digests validate; predecessor terminal state is preserved; implementation commit and CI evidence are present.","from":"RECOVER","inputDigests":["sha256:ad152a2c4a09efa5247fb9893827cf2d914d587395e2751146bb94cae00bad4d"],"sequence":1,"timestamp":"2026-08-30T04:25:00Z","to":"VALIDATE"},{"evidence":"T001/T002 selected: successor state creation and artifact inventory are ready and do not overlap.","from":"VALIDATE","inputDigests":["sha256:ad152a2c4a09efa5247fb9893827cf2d914d587395e2751146bb94cae00bad4d"],"sequence":2,"timestamp":"2026-08-30T04:25:00Z","to":"SELECT"}],"owner":"csm-build","projection":{"allowed":["markdown","html"],"sourceOnly":true},"provenance":{"sourceDigests":["sha256:4c3286411346de7f21ade5badb6bcced1cbd5ee46c034cfe901bf1d53c90fb2c"],"sourcePlan":"art-progress-followups-20260830"},"runId":"run-20260830t042000z-progress-followups-build","schema":"csm-build-state/2","schemaRevision":2,"status":"in_progress"}
