{"artifactId":"art-build-progress-tracking-runtime-20260829","artifacts":[],"completion":null,"control":{"activeTasks":[],"blockers":["unstaged-guard refused the authorized commit because unrelated pre-existing tracked changes remain unstaged; they were not staged, reverted, or committed."],"currentState":"BLOCKED","cycle":0,"lastCheckpoint":"2026-08-30T00:40:00Z: implementation verified; commit blocked by unrelated unstaged tracked changes","lastModelRun":"gpt-5.6-luna / progress-tracking-runtime-build","nextTransition":"none (terminal)"},"inputs":[{"artifactId":"art-progress-tracking-runtime-20260829","digest":"sha256:d8d039766a0292614c8c15d6f26825ae3a4f68735faa0da9f784edf5348a625c","name":"plan","owner":"csm-plan","path":".agents/plans/2026-08-29-progress-tracking-runtime-csm.json","runId":"run-20260829t223000z-progress-runtime","schema":"csm-plan/1","status":"resolved"}],"journal":[{"evidence":"Explicit csm-build request received; selected the saved progress-tracking-runtime plan and preserved unrelated worktree changes.","from":"NOT_STARTED","inputDigests":["sha256:f7b47e9bcd541356fe840b865e76174216b0df865569d7ef83cb068afc"],"sequence":0,"timestamp":"2026-08-29T22:45:00Z","to":"RECOVER"},{"evidence":"Plan/build-state schemas validate; research input digest matches; tracker docs and payload parity were inspected; no unrelated files were modified by this run.","from":"RECOVER","inputDigests":["sha256:f7b47e9bcd541356fe840b865e76174216b0df865569d7ef83cb068afc"],"sequence":1,"timestamp":"2026-08-29T22:50:00Z","to":"VALIDATE"},{"evidence":"T001/T002 integration completed from independent dispatches; schema, tracker contract, package parity, and structural checks passed. T003 is the active runtime task.","from":"VALIDATE","inputDigests":["sha256:f7b47e9bcd541356fe840b865e76174216b0df865569d7ef83cb068afc"],"sequence":2,"timestamp":"2026-08-29T23:05:00Z","to":"INTEGRATE"},{"evidence":"Implementation and final repository gates passed; node:sqlite was available for the environment check. Commit was attempted but refused by unstaged-guard.","from":"INTEGRATE","inputDigests":["sha256:f7b47e9bcd541356fe840b865e76174216b0df865569d7ef83cb068afc"],"sequence":3,"timestamp":"2026-08-30T00:30:00Z","to":"CHECKPOINT"},{"evidence":"Unrelated tracked changes remain unstaged; no unsafe staging, revert, or bypass was performed.","from":"CHECKPOINT","inputDigests":["sha256:f7b47e9bcd541356fe840b865e76174216b0df865569d7ef83cb068afc"],"sequence":4,"timestamp":"2026-08-30T00:40:00Z","to":"BLOCKED"}],"owner":"csm-build","projection":{"allowed":["markdown","html"],"sourceOnly":true},"provenance":{"sourceDigests":["sha256:d8d039766a0292614c8c15d6f26825ae3a4f68735faa0da9f784edf5348a625c"],"sourcePlan":"art-progress-tracking-runtime-20260829"},"runId":"run-20260829t224500z-progress-runtime-build","schema":"csm-build-state/2","schemaRevision":2,"status":"blocked"}
