{"artifactId":"art-build-progress-tracking-implementation-20260829","artifacts":[],"completion":null,"control":{"activeTasks":["T001"],"blockers":["Current checkout is a skills suite without the application baseline required by the implementation plan; creating an unrelated application boundary requires an explicit scope decision."],"currentState":"BLOCKED","cycle":0,"lastCheckpoint":"2026-08-29T20:35:00Z: recovery and validation blocked before dispatch","lastModelRun":"gpt-5.6-luna / progress-tracking-implementation-build","nextTransition":"none (terminal)"},"inputs":[{"artifactId":"art-progress-tracking-implementation-20260829","digest":"sha256:8c18f58245893eb733411bc30f5006fb5c26244711fbb6b10181aac999e81487","name":"plan","owner":"csm-plan","path":".agents/plans/2026-08-29-progress-tracking-implementation-csm.json","runId":"run-20260829t202500z-progress-implementation","schema":"csm-plan/1","status":"resolved"}],"journal":[{"evidence":"Validation found no current-checkout application entrypoint, root npm test script, or root build script. The plan's T001 recovery note requires blocking rather than inventing an application boundary without a product decision.","from":"RECOVER","inputDigests":["sha256:8c18f58245893eb733411bc30f5006fb5c26244711fbb6b10181aac999e81487"],"sequence":0,"timestamp":"2026-08-29T20:35:00Z","to":"BLOCKED"}],"owner":"csm-build","projection":{"allowed":["markdown","html"],"sourceOnly":true},"provenance":{"sourceDigests":["sha256:8c18f58245893eb733411bc30f5006fb5c26244711fbb6b10181aac999e81487"],"sourcePlan":"art-progress-tracking-implementation-20260829"},"runId":"run-20260829t203500z-progress-build","schema":"csm-build-state/2","schemaRevision":2,"status":"blocked"}
