{"artifactId":"art-dynamic-worker-runtime-build-20260912","artifacts":[],"completion":{"commit":{"files":[],"message":"","sha":null,"status":"not-requested"},"evidence":[],"rollback":{"action":"revert T003a files + rerun pack-bootstrap","checkpoint":"git working tree at 717a6b9","status":"available"},"status":"pending","verifiedAt":"2026-09-12T13:43:41.980Z"},"control":{"activeTasks":[],"blockers":[],"currentState":"CHECKPOINT","cycle":13,"lastCheckpoint":"2026-09-12T16:25:47.855Z: cycle 13 checkpoint - T001-T013 + T018-T020/T022/T023 complete; T014-T017 and T021 remain (sandbox/egress/decision-gate); gate green","lastModelRun":"deepseek-flash / dynamic-worker-runtime-build","nextTransition":"CHECKPOINT -> SELECT"},"inputs":[{"artifactId":"art-dynamic-worker-runtime-20260912","digest":"sha256:3bf57050d83e2c2b16fbfeb55857abdb9520ce8a564e604c7516d601f1731b58","name":"plan","owner":"csm-plan","path":".agents/plans/2026-09-12-dynamic-worker-runtime-csm.json","runId":"run-20260912t130612z-26e3b79231cc","schema":"csm-plan/1","status":"resolved"}],"journal":[{"evidence":"explicit csm-build invocation; plan validated ready/NOT_STARTED; docker host available","from":"NOT_STARTED","inputDigests":["sha256:3bf57050d83e2c2b16fbfeb55857abdb9520ce8a564e604c7516d601f1731b58"],"sequence":0,"timestamp":"2026-09-12T13:14:45.169Z","to":"RECOVER"},{"evidence":"baseline validated; applicability warranted complete","from":"RECOVER","sequence":1,"timestamp":"2026-09-12T13:19:37.572Z","to":"VALIDATE"},{"evidence":"G1 T001/T002 spikes dispatched to isolated /tmp","from":"SELECT","sequence":2,"timestamp":"2026-09-12T13:19:37.572Z","to":"DISPATCH"},{"evidence":"T001/T002 CONDITIONAL; user-owned scope/security decisions required before T003/T014/T016","from":"DISPATCH","sequence":3,"timestamp":"2026-09-12T13:19:37.572Z","to":"BLOCKED"},{"evidence":"blocker resolved (Q1 verified, Q2 chosen)","from":"BLOCKED","sequence":4,"timestamp":"2026-09-12T13:43:41.980Z","to":"RECOVER"},{"evidence":"T003a schemas+registry+contracts+payload","from":"DISPATCH","sequence":5,"timestamp":"2026-09-12T13:43:41.980Z","to":"INTEGRATE"},{"evidence":"check-suite OK; registry test pass; cycle 1","from":"VERIFY","sequence":6,"timestamp":"2026-09-12T13:43:41.980Z","to":"CHECKPOINT"},{"evidence":"T003b capabilities /2 migration","from":"SELECT","sequence":7,"timestamp":"2026-09-12T13:50:46.001Z","to":"DISPATCH"},{"evidence":"check-suite OK; test-orchestrate 296/0; cycle 2","from":"VERIFY","sequence":8,"timestamp":"2026-09-12T13:50:46.001Z","to":"CHECKPOINT"},{"evidence":"T004 concurrency wiring","from":"SELECT","sequence":9,"timestamp":"2026-09-12T13:57:17.603Z","to":"DISPATCH"},{"evidence":"test-orchestrate 300/0; cycle 3","from":"VERIFY","sequence":10,"timestamp":"2026-09-12T13:57:17.603Z","to":"CHECKPOINT"},{"evidence":"T005 worker event emission","from":"SELECT","sequence":11,"timestamp":"2026-09-12T13:59:44.145Z","to":"DISPATCH"},{"evidence":"telemetry worker events 4/4; check-suite OK; cycle 4","from":"VERIFY","sequence":12,"timestamp":"2026-09-12T13:59:44.145Z","to":"CHECKPOINT"},{"evidence":"T006 identity/rehydration/reducer","from":"SELECT","sequence":13,"timestamp":"2026-09-12T14:04:27.130Z","to":"DISPATCH"},{"evidence":"worker-state 4/4; test-orchestrate 304/0; cycle 5","from":"VERIFY","sequence":14,"timestamp":"2026-09-12T14:04:27.130Z","to":"CHECKPOINT"},{"evidence":"T007 worker table renderer","from":"SELECT","sequence":15,"timestamp":"2026-09-12T14:19:50.863Z","to":"DISPATCH"},{"evidence":"projection tests pass; test-orchestrate 304/0; cycle 6","from":"VERIFY","sequence":16,"timestamp":"2026-09-12T14:19:50.864Z","to":"CHECKPOINT"},{"evidence":"T008 redaction re-verification","from":"SELECT","sequence":17,"timestamp":"2026-09-12T15:08:19.935Z","to":"DISPATCH"},{"evidence":"telemetry 20/20; test-orchestrate 304/0; cycle 7","from":"VERIFY","sequence":18,"timestamp":"2026-09-12T15:08:19.935Z","to":"CHECKPOINT"},{"evidence":"T009 worker lease/heartbeat","from":"SELECT","sequence":19,"timestamp":"2026-09-12T15:30:17.251Z","to":"DISPATCH"},{"evidence":"store 52/52 node22; test-orchestrate 304/0; cycle 8","from":"VERIFY","sequence":20,"timestamp":"2026-09-12T15:30:17.251Z","to":"CHECKPOINT"},{"evidence":"T010 cancellation/timeout + stale reconciliation","from":"SELECT","sequence":21,"timestamp":"2026-09-12T15:51:12.069Z","to":"DISPATCH"},{"evidence":"autonomy 15/15; test-orchestrate 305/0; cycle 9","from":"VERIFY","sequence":22,"timestamp":"2026-09-12T15:51:12.069Z","to":"CHECKPOINT"},{"evidence":"T011 hybrid dynamic scheduler","from":"SELECT","sequence":23,"timestamp":"2026-09-12T16:06:52.236Z","to":"DISPATCH"},{"evidence":"dynamic-scheduler 6/6; test-orchestrate 311/0; cycle 10","from":"VERIFY","sequence":24,"timestamp":"2026-09-12T16:06:52.236Z","to":"CHECKPOINT"},{"evidence":"T012/T013 hooks + adversarial tests","from":"SELECT","sequence":25,"timestamp":"2026-09-12T16:25:47.862Z","to":"DISPATCH"},{"evidence":"T018/T019 hardening + thin entry","from":"SELECT","sequence":26,"timestamp":"2026-09-12T16:25:47.862Z","to":"DISPATCH"},{"evidence":"T020/T022/T023 docs + policy mirror","from":"SELECT","sequence":27,"timestamp":"2026-09-12T16:25:47.862Z","to":"DISPATCH"},{"evidence":"targeted tests 17/17; check-suite OK; cycle 13","from":"VERIFY","sequence":28,"timestamp":"2026-09-12T16:25:47.862Z","to":"CHECKPOINT"}],"owner":"csm-build","projection":{"allowed":["markdown","html"],"sourceOnly":true},"provenance":{"sourceDigests":["sha256:3bf57050d83e2c2b16fbfeb55857abdb9520ce8a564e604c7516d601f1731b58"],"sourcePlan":"art-dynamic-worker-runtime-20260912"},"runId":"run-20260912t131500z-dynamic-worker-runtime-build","schema":"csm-build-state/2","schemaRevision":2,"status":"in_progress"}
