{"artifactId":"art-unblock-orchestrator-release-evidence-build-20260831","artifacts":[],"completion":null,"control":{"activeTasks":[],"blockers":["Required browser E2E failed 14 of 89 assertions","Required generated-sandbox probe has no host provider or attestation"],"currentState":"BLOCKED","cycle":0,"lastCheckpoint":"2026-08-31T12:30:00Z: T001 passed; T002 and T003 blocked on real host evidence","lastModelRun":"gpt-5.6-luna / unblock-orchestrator-release-evidence-build","nextTransition":"none (terminal)"},"inputs":[{"artifactId":"art-unblock-orchestrator-release-evidence-20260831","digest":"sha256:46a9270fd88220991db3a14cfe1ff89865f936651a0c8b224b1ffc08e86eb19f","name":"plan","owner":"csm-plan","path":".agents/plans/2026-08-31-unblock-orchestrator-release-evidence-csm.json","runId":"run-20260831t110000z-unblock-orchestrator-release-evidence","schema":"csm-plan/1","status":"resolved"}],"journal":[{"evidence":"Explicit csm-build request received; selected the saved unblock plan and preserved the clean committed baseline.","from":"NOT_STARTED","sequence":0,"timestamp":"2026-08-31T12:00:00Z","to":"RECOVER"},{"evidence":"T001 exact-SHA baseline passed. Required browser E2E reached chromium-vnc but failed 14 of 89 assertions. Required sandbox probe returned sandbox_unavailable because no provider or host-owned capability was supplied. Resume through RECOVER after browser fixture/interaction repair and an approved sandbox provider are available.","from":"RECOVER","sequence":1,"timestamp":"2026-08-31T12:30:00Z","to":"BLOCKED"}],"owner":"csm-build","projection":{"allowed":["markdown","html"],"sourceOnly":true},"provenance":{"sourceDigests":["sha256:46a9270fd88220991db3a14cfe1ff89865f936651a0c8b224b1ffc08e86eb19f"],"sourcePlan":"art-unblock-orchestrator-release-evidence-20260831"},"runId":"run-20260831t120000z-unblock-orchestrator-release-evidence-build","schema":"csm-build-state/2","schemaRevision":2,"status":"blocked"}
