{"artifactId":"art-replace-npm-audit-ci-gate-build-20260904","artifacts":[],"completion":null,"control":{"activeTasks":[],"blockers":[],"currentState":"COMPLETE","cycle":1,"lastCheckpoint":"2026-09-04T18:15:00Z: run 33903446355 green on exact SHA 0ec452a; all tasks complete","lastModelRun":"gpt-5.6-sol / replace-npm-audit-ci-gate-build","nextTransition":"none (terminal)"},"inputs":[{"artifactId":"art-replace-npm-audit-ci-gate-20260904","digest":"sha256:2807ed4e332d1117b8aa921354ea704fc58367d5dabf2787c0c43dab9245324b","name":"plan","owner":"csm-plan","path":".agents/plans/2026-09-04-replace-npm-audit-ci-gate-csm.json","runId":"run-20260904t050000z-replace-npm-audit-ci-gate","schema":"csm-plan/1","status":"resolved"}],"journal":[{"evidence":"Explicit csm-build request selected the saved successor plan. Repository is clean at 1ce7913; retry-only pnpm audit is the current audit interface and no OSV verifier exists yet.","from":"NOT_STARTED","sequence":0,"timestamp":"2026-09-04T06:00:00Z","to":"RECOVER"},{"evidence":"Explicit csm-build request selected the saved successor plan. Repository is clean at 1ce7913; the retry-only pnpm audit is the current audit interface and no OSV verifier exists yet.","from":"NOT_STARTED","sequence":0,"timestamp":"2026-09-04T06:00:00Z","to":"RECOVER"},{"evidence":"T001/T002 implemented and validated (22/22 focused tests, fmt/lint/check/whitespace, YAML valid). Independent review found 12 findings; critical GCS size-as-string defect repaired plus 8 others; warning-prefix residual documented. T003 exact-SHA CI awaits commit/push authorization.","from":"RECOVER","sequence":1,"timestamp":"2026-09-04T07:30:00Z","to":"CHECKPOINT"},{"evidence":"Authorized push executed through repairs 727251a (DB cache env), fa3a24c (poll window), 0ec452a (exit-code postconditions). Final run 33903446355 completed success on exact SHA 0ec452a: Dependency audit clean (0 vulnerabilities, generation 1788544127307733), Repository gates green incl. verifier tests, Adapter integrations green with cleanup_status=0.","from":"CHECKPOINT","sequence":2,"timestamp":"2026-09-04T18:15:00Z","to":"COMPLETE"}],"owner":"csm-build","projection":{"allowed":["markdown","html"],"sourceOnly":true},"provenance":{"sourceDigests":["sha256:2807ed4e332d1117b8aa921354ea704fc58367d5dabf2787c0c43dab9245324b"],"sourcePlan":"art-replace-npm-audit-ci-gate-20260904"},"runId":"run-20260904t060000z-replace-npm-audit-ci-gate-build","schema":"csm-build-state/2","schemaRevision":2,"status":"complete"}
