{"artifactId":"art-docker-host-attested-sandbox-build-20260831","artifacts":[],"completion":null,"control":{"activeTasks":["T004"],"blockers":["CI run 33428762495 was green but skipped required adapter integration because approval variables were unset"],"currentState":"BLOCKED","cycle":0,"lastCheckpoint":"2026-08-31T19:30:00Z: commit 7638d41 pushed; default CI green, required adapter gate skipped","lastModelRun":"gpt-5.6-luna / docker-host-attested-sandbox-build","nextTransition":"none (terminal)"},"inputs":[{"artifactId":"art-docker-host-attested-sandbox-20260831","digest":"sha256:397b745af4286d3c9f10a11f994df1a8511fe57c0126eb9b32fef11ac10c7ae6","name":"plan","owner":"csm-plan","path":".agents/plans/2026-08-31-docker-host-attested-sandbox-csm.json","runId":"run-20260831t150000z-docker-host-attested-sandbox","schema":"csm-plan/1","status":"resolved"}],"journal":[{"evidence":"Explicit csm-build request selected the Docker sandbox plan; committed baseline and protected state inspected.","from":"NOT_STARTED","sequence":0,"timestamp":"2026-08-31T16:00:00Z","to":"RECOVER"},{"evidence":"Plan schema and applicability validate; current Docker/image/runtime prerequisites require implementation-time verification.","from":"RECOVER","sequence":1,"timestamp":"2026-08-31T16:00:00Z","to":"VALIDATE"},{"evidence":"Selected T001 to freeze the provider contract before Docker provider implementation.","from":"VALIDATE","sequence":2,"timestamp":"2026-08-31T16:00:00Z","to":"SELECT"},{"evidence":"T001 contract passed; T002 Docker provider implementation was dispatched.","from":"SELECT","sequence":3,"timestamp":"2026-08-31T16:30:00Z","to":"DISPATCH"},{"evidence":"T002 provider implementation and positive disposable probe were returned for integration.","from":"DISPATCH","sequence":4,"timestamp":"2026-08-31T16:30:00Z","to":"INTEGRATE"},{"evidence":"Focused Docker/provider tests pass, but independent review found hardcoded attestation facts, unbounded host buffering, incomplete process cleanup proof, and missing payload/CI integration.","from":"INTEGRATE","sequence":5,"timestamp":"2026-08-31T16:30:00Z","to":"VERIFY"},{"evidence":"Independent security review identified critical and high-severity truthfulness and containment defects.","from":"VERIFY","sequence":6,"timestamp":"2026-08-31T16:30:00Z","to":"REVIEW"},{"evidence":"T002 requires root-cause repair before positive sandbox evidence can be accepted.","from":"REVIEW","sequence":7,"timestamp":"2026-08-31T16:30:00Z","to":"REPAIR"},{"evidence":"Docker composition repair, schema compatibility, generated-provider integration, and final local gates were revalidated.","from":"REPAIR","sequence":8,"timestamp":"2026-08-31T19:00:00Z","to":"VALIDATE"},{"evidence":"T001-T003 are verified; T004 requires only release synchronization and exact-SHA CI.","from":"VALIDATE","sequence":9,"timestamp":"2026-08-31T19:00:00Z","to":"SELECT"},{"evidence":"T004 release synchronization was prepared in the staged worktree; no external push was authorized in this invocation.","from":"SELECT","sequence":10,"timestamp":"2026-08-31T19:00:00Z","to":"DISPATCH"},{"evidence":"Payload regeneration, artifact indexing, and parent-plan evidence are staged.","from":"DISPATCH","sequence":11,"timestamp":"2026-08-31T19:00:00Z","to":"INTEGRATE"},{"evidence":"make audit/check/fmt-check/lint/test passed; full test suite passed with 1283 tests and one environment skip.","from":"INTEGRATE","sequence":12,"timestamp":"2026-08-31T19:00:00Z","to":"VERIFY"},{"evidence":"Final Docker review and exact generated-provider composition checks passed; CI remains unverified.","from":"VERIFY","sequence":13,"timestamp":"2026-08-31T19:00:00Z","to":"REVIEW"},{"evidence":"T001-T003 complete; T004 is blocked only by explicit commit/push and CI verification.","from":"REVIEW","sequence":14,"timestamp":"2026-08-31T19:00:00Z","to":"CHECKPOINT"},{"evidence":"The release is staged and locally green, but exact-SHA CI requires an explicitly authorized commit and push.","from":"CHECKPOINT","sequence":15,"timestamp":"2026-08-31T19:00:00Z","to":"BLOCKED"},{"evidence":"User authorized commit, push, and merge actions.","from":"BLOCKED","sequence":16,"timestamp":"2026-08-31T19:30:00Z","to":"RECOVER"},{"evidence":"Commit 7638d41 is pushed to origin/main and CI run 33428762495 completed successfully.","from":"RECOVER","sequence":17,"timestamp":"2026-08-31T19:30:00Z","to":"VALIDATE"},{"evidence":"CI default gates are green, but the required adapter integration step was skipped because CSM_ADAPTER_INTEGRATIONS and CSM_ADAPTER_INTEGRATIONS_APPROVED are unset. Resume after those variables and CI Docker/browser prerequisites are enabled.","from":"VALIDATE","sequence":18,"timestamp":"2026-08-31T19:30:00Z","to":"BLOCKED"}],"owner":"csm-build","projection":{"allowed":["markdown","html"],"sourceOnly":true},"provenance":{"sourceDigests":["sha256:397b745af4286d3c9f10a11f994df1a8511fe57c0126eb9b32fef11ac10c7ae6"],"sourcePlan":"art-docker-host-attested-sandbox-20260831"},"runId":"run-20260831t160000z-docker-host-attested-sandbox-build","schema":"csm-build-state/2","schemaRevision":2,"status":"blocked"}
