{"artifactId":"art-dynamic-worker-runtime-remaining-build-20260912","artifacts":[],"completion":null,"control":{"activeTasks":[],"blockers":[],"currentState":"CHECKPOINT","cycle":1,"lastCheckpoint":"2026-09-12T18:25:08.413Z: remaining cycle 1 - T002/T003/T004/T013 complete; T001 partial; T005-T012 remain","lastModelRun":"deepseek-flash / dwrr-remaining-build","nextTransition":"CHECKPOINT -> SELECT"},"inputs":[{"artifactId":"art-dynamic-worker-runtime-remaining-20260912","digest":"sha256:ebc218438aee0258ebb224b39d9943ce593e863ac8d0985adc26dadff17ed3b6","name":"plan","owner":"csm-plan","path":".agents/plans/2026-09-12-dynamic-worker-runtime-remaining-csm.json","runId":"run-20260912t183000z-dwrr-remaining","schema":"csm-plan/1","status":"resolved"}],"journal":[{"evidence":"explicit csm-build invocation","from":"NOT_STARTED","sequence":0,"timestamp":"2026-09-12T18:25:35.448Z","to":"RECOVER"},{"evidence":"T002/T003/T004/T013","from":"SELECT","sequence":1,"timestamp":"2026-09-12T18:25:35.448Z","to":"DISPATCH"},{"evidence":"test-orchestrate 325/0 x2; gates green; cycle 1","from":"VERIFY","sequence":2,"timestamp":"2026-09-12T18:25:35.448Z","to":"CHECKPOINT"}],"owner":"csm-build","projection":{"allowed":["markdown","html"],"sourceOnly":true},"provenance":{"sourceDigests":["sha256:ebc218438aee0258ebb224b39d9943ce593e863ac8d0985adc26dadff17ed3b6"],"sourcePlan":"art-dynamic-worker-runtime-remaining-20260912"},"runId":"run-20260912t183000z-dwrr-remaining-build","schema":"csm-build-state/2","schemaRevision":2,"status":"in_progress"}
