{"artifactId":"art-npm-audit-ci-resilience-build-20260904","artifacts":[],"completion":null,"control":{"activeTasks":["T003"],"blockers":[],"currentState":"RECOVER","cycle":0,"lastCheckpoint":"2026-09-04T02:00:00Z: commit/push authorization received; preparing scoped audit resilience commit","lastModelRun":"gpt-5.6-luna / npm-audit-ci-resilience-build","nextTransition":"RECOVER -> VALIDATE"},"inputs":[{"artifactId":"art-npm-audit-ci-resilience-20260903","digest":"sha256:7856aadd5a67d369db201e3075664189e1b5039a250b651bacdf696f35c6669e","name":"plan","owner":"csm-plan","path":".agents/plans/2026-09-03-npm-audit-ci-resilience-csm.json","runId":"run-20260903t234500z-npm-audit-ci-resilience","schema":"csm-plan/1","status":"resolved"}],"journal":[{"evidence":"Explicit csm-build request selected the saved audit resilience plan. Repository is clean at 2a82b8e; repeated CI audit failures are recorded as ERR_SOCKET_TIMEOUT against registry.npmjs.org.","from":"NOT_STARTED","sequence":0,"timestamp":"2026-09-04T00:15:00Z","to":"RECOVER"},{"evidence":"T001 selected bounded retry after current pnpm documentation confirmed --ignore-registry-errors would be false-green. T002 implemented three 90-second retries and local audit recovered after transient timeouts; lint, conformance, formatting, and wiring tests pass. T003 is blocked pending explicit commit/push authorization.","from":"RECOVER","sequence":1,"timestamp":"2026-09-04T01:00:00Z","to":"BLOCKED"},{"evidence":"Focused implementation and repository checks pass locally, but this invocation did not authorize commit/push. Exact-SHA CI verification remains incomplete.","from":"BLOCKED","sequence":2,"timestamp":"2026-09-04T01:30:00Z","to":"BLOCKED"}],"owner":"csm-build","projection":{"allowed":["markdown","html"],"sourceOnly":true},"provenance":{"sourceDigests":["sha256:7856aadd5a67d369db201e3075664189e1b5039a250b651bacdf696f35c6669e"],"sourcePlan":"art-npm-audit-ci-resilience-20260903"},"runId":"run-20260904t001500z-npm-audit-ci-resilience-build","schema":"csm-build-state/2","schemaRevision":2,"status":"in_progress"}
