{"artifactId":"art-build-remove-opencode-proper-20260830","artifacts":[],"completion":{"commit":{"files":["csm-orchestrate","csm-build/SKILL.md","bootstrap/package/payload","tests/orchestrate-csm-build-handoff.test.mjs"],"message":"feat: add csm-build execution handoff","sha":"5cf0284","status":"recorded"},"evidence":[],"rollback":{"action":"Restore only the csm-build handoff continuation if required; preserve prior no-OpenCode commits and unrelated changes.","checkpoint":"working tree before csm-build handoff continuation","status":"available"},"status":"complete","verifiedAt":"2026-08-31T03:30:00Z"},"control":{"activeTasks":[],"blockers":[],"currentState":"COMPLETE","cycle":0,"lastCheckpoint":"2026-08-31T03:30:00Z: csm-build-owned handoff completed; direct routes, control plane, packaging, tests, and CI verified","lastModelRun":"gpt-5.6-luna / remove-opencode-build","nextTransition":"COMPLETE"},"inputs":[{"artifactId":"art-remove-opencode-proper-20260830","digest":"sha256:da811a1b4a6cb8920eb3963b9964756b2102da38c6997222c464756b6d52ca34","name":"plan","owner":"csm-plan","path":".agents/plans/2026-08-30-remove-opencode-proper-csm.json","runId":"run-20260830t150000z-remove-opencode-proper","schema":"csm-plan/1","status":"resolved"}],"journal":[{"evidence":"Explicit user build request received; plan, cited inputs, and worktree baseline are being reconstructed before dispatch.","from":"NOT_STARTED","inputDigests":[],"sequence":0,"timestamp":"2026-08-30T15:10:00Z","to":"RECOVER"},{"evidence":"No-OpenCode executor, direct handlers, lifecycle, review, recovery, packaging, and outcome tests are implemented and verified. Full model-led/browse/autoresearch runtime coverage is unavailable, and SQLite-specific cases remain skipped under the current Node runtime.","from":"RECOVER","inputDigests":["sha256:12abd801bdfb026109810f27e476b72d09f4edf242f02e50ed93292b3d6c89a0"],"sequence":1,"timestamp":"2026-08-31T01:45:00Z","to":"BLOCKED"},{"evidence":"User selected option 3: csm-build owns instruction-led execution in the current agent context and returns typed results to csm-orchestrate. Resume requires validating the handoff contract and route ownership matrix.","from":"BLOCKED","inputDigests":["sha256:45af64e68f20d32ee35c51357c3ab87fe0936b5f2e0efd1c91f9e99c28a16cfd"],"sequence":2,"timestamp":"2026-08-31T03:15:00Z","to":"RECOVER"},{"evidence":"csm-build-owned handoff implemented and tested; direct handlers, durable recovery, independent review, no-OpenCode removal, package parity, full orchestrator tests, and CI 33352191831 passed.","from":"RECOVER","inputDigests":["sha256:da811a1b4a6cb8920eb3963b9964756b2102da38c6997222c464756b6d52ca34"],"sequence":3,"timestamp":"2026-08-31T03:30:00Z","to":"COMPLETE"}],"owner":"csm-build","projection":{"allowed":["markdown","html"],"sourceOnly":true},"provenance":{"sourceDigests":["sha256:da811a1b4a6cb8920eb3963b9964756b2102da38c6997222c464756b6d52ca34"],"sourcePlan":"art-remove-opencode-proper-20260830"},"runId":"run-20260830t151000z-remove-opencode-build","schema":"csm-build-state/2","schemaRevision":2,"status":"complete"}
